{
  "assets": ["AAPL", "MSFT", "NVDA", "TLT"],
  "expectedReturns": [0.11, 0.10, 0.16, 0.04],
  "covariance": [
    [0.0625, 0.0300, 0.0450, -0.0040],
    [0.0300, 0.0484, 0.0400, -0.0030],
    [0.0450, 0.0400, 0.1600, -0.0050],
    [-0.0040, -0.0030, -0.0050, 0.0196]
  ],
  "objective": "max_sharpe",
  "riskFreeRate": 0.02,
  "maxWeight": 0.4,
  "currentWeights": {"AAPL": 0.25, "MSFT": 0.25, "NVDA": 0.25, "TLT": 0.25},
  "maxTurnover": 0.2
}
